{
  "artifact_id": "blueprint:autonomous",
  "artifact_kind": "blueprint",
  "artifact_path": "config/blueprints/autonomous.json",
  "framework_version": "TBI-2025.12.0",
  "inpact": {
    "instant": { "status": "n_a", "evidence": "The blueprint is static config; the autonomous systems it prescribes target real-time dashboards, but the blueprint artifact itself has no latency surface." },
    "natural": { "status": "satisfied", "evidence": "Prescribes an AI COO natural-language command interface and a visitor AI assistant with a 7-component system prompt." },
    "permitted": { "status": "satisfied", "evidence": "Prescribes a Governance & Safety Engine: confidence scoring (>0.80 proceed), approval boundaries, escalation protocol, per-agent budget enforcement with hard auto-pause." },
    "adaptive": { "status": "satisfied", "evidence": "Prescribes a meta-agent self-improvement loop (performance analysis, prompt optimization, experiments)." },
    "contextual": { "status": "satisfied", "evidence": "Prescribes a RAG knowledge system and cross-session memory." },
    "transparent": { "status": "satisfied", "evidence": "Prescribes agent activity logging with trace IDs and rolling-avg duration, a 24-tab Intelligence OS dashboard, and an agent behavior monitor." }
  },
  "goals": {
    "governance": { "status": "satisfied", "evidence": "Governance engine, escalation chain, approval boundaries, and budget enforcement are first-class features." },
    "observability": { "status": "satisfied", "evidence": "Activity logging + trace IDs + Intelligence OS dashboard + behavior monitor." },
    "availability": { "status": "satisfied", "evidence": "Self-healing agents, orchestrator error isolation, atomic task checkout, and Promise.allSettled resilient loading." },
    "lexicon": { "status": "satisfied", "evidence": "Standardized department/agent/initiative/ticket vocabulary and a 6-model data schema." },
    "solid": { "status": "satisfied", "evidence": "Idempotent findOrCreate seeding, generic runAgent() wrapper with error isolation, confidence thresholds, budget hard-pause." }
  },
  "layers": [
    { "layer": 4, "name": "Intelligent Retrieval (RAG)", "how": "RAG knowledge system + cross-session memory." },
    { "layer": 5, "name": "Agent-Aware Governance", "how": "Governance & Safety Engine with approval boundaries and escalation." },
    { "layer": 6, "name": "Observability & Feedback", "how": "Activity logging, trace IDs, Intelligence OS dashboard, behavior monitor." },
    { "layer": 7, "name": "Multi-Agent Orchestration", "how": "Orchestrator + cron-scheduled agent fleets across departments." }
  ],
  "risk_level": "MODERATE",
  "verdict": "conditional",
  "approver": { "name": "Ali Muwwakkil", "email": "ali@colaberry.com" },
  "verified_at": "2026-06-20T00:00:00Z",
  "notes": "This blueprint is TBI-aligned by construction (governance, observability, safety, self-healing baked in). COMPLIANCE NOTE: because it generates autonomous agent fleets, any project built on this blueprint must still produce a per-artifact TBI attestation for each agent it instantiates."
}
