{
  "artifact_id": "advisory:deep_plan_generator",
  "artifact_kind": "advisory",
  "artifact_path": "execution/advisory/deep_plan.py",
  "framework_version": "TBI-2025.12.0",
  "inpact": {
    "instant": { "status": "satisfied", "evidence": "Runs in the My-Day build daemon thread (myday_build_orchestrator) with store-first output and build_status.json progress writes, so the founder sees the plan land in one build pass without a stalled UI." },
    "natural": { "status": "satisfied", "evidence": "Outputs plain-language user stories ('As a ... I want ... so that ...') with Given/When/Then acceptance for non-technical founders — no jargon, the Gherkin doubles as the demo script." },
    "permitted": { "status": "satisfied", "evidence": "Generation is operator-initiated inside the approval-gated My-Day build flow; the only side effects are todos + documents published to the operator's OWN Basecamp via operator-scoped OAuth (basecamp_build_writer / project_plan_reconciler). It references no internal code and cannot post outside the operator's project." },
    "adaptive": { "status": "satisfied", "evidence": "Each artifact runs a maker/checker/refiner loop: a separate checker grades against a strict rubric and the refiner fixes the named gaps, bounded by MAX_REFINE (no unbounded loop). The maker never grades itself." },
    "contextual": { "status": "satisfied", "evidence": "Domain, users, entities, and stack are derived from the idea + discovery choices; the chain is sequential so every story cites the exact REQ-### it fulfills (traceability by construction). Trust requirements are GROUNDED in the pinned canonical TBI framework (execution/advisory/tbi_primer.py, TBI-2025.12.0, mirroring directives/compliance/trust-before-intelligence.md) injected into the prompts — not the model's parametric guess — and that primer ships as a document with every plan so any builder has the definition inline." },
    "transparent": { "status": "satisfied", "evidence": "Store-first writes REQUIREMENTS/ARCHITECTURE/BUILD_GUIDE/TRACEABILITY.md + deep_plan.json to output/{slug}/; the Requirements Traceability Matrix is published to Basecamp; each todo shows Fulfills:REQ-### + Gherkin; the deterministic gate result is logged. The full plan is inspectable." }
  },
  "goals": {
    "governance": { "status": "satisfied", "evidence": "Maker/checker separation (the maker never grades itself) plus the deterministic trace gate (deep_plan_trace) that FAILS CLOSED on an orphan must-have requirement. Declared as a governed runtime entrypoint in config/tbi_runtime_agents.json (recommend_only) and runs only inside the approval-gated build pipeline." },
    "observability": { "status": "satisfied", "evidence": "Logs each stage's checker score + pass and the trace-gate summary; writes build_status.json at each phase; emits the RTM document so coverage is visible to a reviewer." },
    "availability": { "status": "satisfied", "evidence": "Runs as a non-blocking background daemon; store-first persists every artifact to disk before any Basecamp publish so a heavy or failed run never strands the build; the orchestrator records an error status instead of raising." },
    "lexicon": { "status": "satisfied", "evidence": "Canonical vocabulary throughout — REQ-### requirements, STORY-### slices, dynamic r0..rN releases, Given/When/Then acceptance — consistent with docs/specs/myday-project-build-story-decomposition.md." },
    "solid": { "status": "satisfied", "evidence": "The deterministic traceability gate and the pure helper functions are covered by first-class unit tests (tests/execution/advisory/test_deep_plan_trace.py, test_deep_plan.py, test_deep_plan_publisher.py); the gate is LLM-free and rerunnable. The TBI primer's fidelity to the pinned framework snapshot is machine-guarded by test_tbi_primer_provenance.py (deterministic primer-vs-snapshot drift-guard, plus an opt-in upstream GitHub diff), so trust grounding cannot silently drift from the canonical source." }
  },
  "layers": [
    { "layer": 5, "name": "Agent-Aware Governance", "how": "Sequential maker/checker (maker never grades itself) + a deterministic fail-closed traceability gate; the generator is a declared, recommend-only runtime entrypoint." },
    { "layer": 6, "name": "Observability & Feedback", "how": "Per-stage checker scores, the trace-gate summary, build_status.json progress, and a published RTM make the plan's quality and coverage observable." },
    { "layer": 7, "name": "Multi-Agent Orchestration", "how": "The chain is itself a maker/checker/refiner orchestration, and it designs the product's multi-agent system (bounded contexts → agents owning REQ-ids)." }
  ],
  "risk_level": "MODERATE",
  "verdict": "compliant",
  "approver": { "name": "Ali Muwwakkil", "email": "ali@colaberry.com" },
  "verified_at": "2026-06-28T00:00:00Z",
  "notes": "Tier-0 runtime AI now under the TBI gate (previously uncovered). The story-driven generator replaces the parallel ticket generator; its traceability gate is deterministic and fail-closed, so the strongest trust control (every story coordinates the requirements document) is enforced by code, not by the model."
}
