{
  "artifact_id": "agent:social_media_uiux_designer",
  "artifact_kind": "agent",
  "artifact_path": "agents/social_media_uiux_designer.md",
  "framework_version": "TBI-2025.12.0",
  "inpact": {
    "instant": { "status": "n_a", "evidence": "Design-time creative persona invoked interactively in VS Code / Claude Code; human-paced drafting, no sub-second response SLO applies." },
    "natural": { "status": "satisfied", "evidence": "One-intent questions; progressive specificity (Audience & Goal -> Channel & Format -> Concept -> Draft); plain language with jargon explained in line." },
    "permitted": { "status": "satisfied", "evidence": "Suggests, never decides; drafts only and never publishes/posts/ships; any public-facing action is out of scope and requires explicit approval plus a separate deterministic execution path." },
    "adaptive": { "status": "satisfied", "evidence": "Produces multiple options per request and refines against user choices; records selected drafts and approvals via state_manager; participates in the self-annealing loop (CLAUDE.md section 5)." },
    "contextual": { "status": "satisfied", "evidence": "Reads the relevant directive and current locked project state (idea/audience/constraints) before producing any design or content." },
    "transparent": { "status": "satisfied", "evidence": "Never fabricates metrics/claims; flags unsourceable claims and ambiguity as blocking conditions; records drafts and approvals through execution scripts." }
  },
  "goals": {
    "governance": { "status": "satisfied", "evidence": "Approval gates enforced before any deliverable is final or handed off; brand/claims guardrails block fabricated or unapproved claims; never skips gates or mixes layers." },
    "observability": { "status": "satisfied", "evidence": "Selected drafts, options chosen, and approvals recorded through state_manager; decisions are reconstructable." },
    "availability": { "status": "n_a", "evidence": "Interactive design-time persona, not a hosted always-on service; no uptime SLO applies." },
    "lexicon": { "status": "satisfied", "evidence": "Anchors brand voice and terminology to the locked project state; does not invent vocabulary; defaults to inclusive, accessible language." },
    "solid": { "status": "satisfied", "evidence": "Delegates recording and validation to deterministic, tested scripts (state_manager, quality_gate_runner) covered by /tests; produces text specs rather than executing publishing actions." }
  },
  "layers": [
    { "layer": 5, "name": "Agent-Aware Governance", "how": "Approval gates plus drafts-only / never-publish authority model; public-facing actions out of scope." },
    { "layer": 6, "name": "Observability & Feedback", "how": "state_manager records selected drafts and approvals for every deliverable." },
    { "layer": 4, "name": "Intelligent Retrieval (RAG)", "how": "Reads the relevant directive and locked project state (idea/audience/constraints) before generating." }
  ],
  "risk_level": "LOW",
  "verdict": "conditional",
  "approver": { "name": "Ali Muwwakkil", "email": "ali@colaberry.com" },
  "verified_at": "2026-06-25T00:00:00Z"
}
